{
  "schemaName": "lcim.event",
  "schemaVersion": "1.0.0",
  "kind": "ASSESSMENT",
  "invocationId": "lcim_inv_11111111111111111111111111111111",
  "workUnitId": "lcim_wu_0123456789abcdef0123456789abcdef",
  "occurredAt": "2025-01-01T00:00:02.000Z",
  "assessmentResult": "ACCEPTED",
  "summary": "fixture: successful invocation",
  "evidenceRefs": [
    "fixture://evidence/1"
  ],
  "runId": "lcim_run_0123456789abcdef0123456789abcdef",
  "seq": 3,
  "prevDigest": "c5ded0849a6e526440b4ef010682ee7b19f827075bc6784f7ad99fdada4fb483",
  "digest": "0da6ea20a5764e2170383a73fded2c3da01a739cf9aae76c206817b83dc6c490"
}
