{
  "schemaName": "lcim.event",
  "schemaVersion": "1.0.0",
  "kind": "START",
  "invocationId": "lcim_inv_11111111111111111111111111111111",
  "workUnitId": "lcim_wu_0123456789abcdef0123456789abcdef",
  "occurredAt": "2025-01-01T00:00:00.000Z",
  "provider": "deepseek",
  "model": "deepseek-flash",
  "role": "WORKER",
  "reasoningEffort": "xhigh",
  "runId": "lcim_run_0123456789abcdef0123456789abcdef",
  "seq": 1,
  "prevDigest": "0000000000000000000000000000000000000000000000000000000000000000",
  "digest": "775adec74bdee3d2d3b40cfd231aea194b2daa83fea31cbb54c742fed42554ed"
}
